{
  "strategy": {
    "symbol": "BTC/USD",
    "timeframe": "1h",
    "ema_length": 20,
    "ema_fast": 12,
    "ema_slow": 26,
    "rsi_period": 14,
    "atr_multiplier": 2,
    "volume_multiplier": 1.5
  },
  "trading_window": {
    "start_hour": 0,
    "end_hour": 24,
    "max_trades_per_day": 5
  },
  "risk": {
    "max_daily_loss": 2,
    "lookback": 5,
    "stop_loss_percent": 2,
    "take_profit_percent": 2,
    "risk_per_trade": 0.02
  },
  "notifications": {
    "email_enabled": true,
    "smtp_server": "smtp.gmail.com",
    "smtp_port": 465,
    "sender": "your@email.com",
    "receiver": "your@email.com"
  },
  "fvg_strategy": {
    "min_gap_size": 10,
    "direction": "both",
    "position_size": 0.1,
    "lookback": 5
  }
}
